{"schema_version":"1.0.0","rules_version":"fixture-v1","engine_version":"catalog-extraction-v1","evidence_kind":"synthetic","identity_strategy":"source-identity-v1","matching_fingerprint":"aaaaaaaaaaaaaaaaaaaaaaaaaaaaaaaaaaaaaaaaaaaaaaaaaaaaaaaaaaaaaaaa","binding_contract_version":"matching-extraction-binding-v1","binding_hash":"bbbbbbbbbbbbbbbbbbbbbbbbbbbbbbbbbbbbbbbbbbbbbbbbbbbbbbbbbbbbbbbb","adapters":[],"rules":[],"input_hashes":{},"snapshot_hashes":[],"output_hashes":{},"sources":[],"counts":{},"structure_hash":"cccccccccccccccccccccccccccccccccccccccccccccccccccccccccccccccc","status":"synthetic","blocking_reasons":[],"artifacts":[],"semantic_fingerprint":"dddddddddddddddddddddddddddddddddddddddddddddddddddddddddddddddd","generated_at":null}
